[
  {
    "id": "check_programming_model_v2",
    "category": "project_structure",
    "section": "programming_model",
    "label": "Programming model v2",
    "description": "Confirms the project uses the Azure Functions Python v2 decorator-based programming model (via @app. or @bp. decorators).",
    "type": "source_code_contains",
    "required": false,
    "condition": {
      "keyword": "@app.|@bp.",
      "mode": "ast"
    },
    "hint": "Use func.FunctionApp() and decorator-based triggers such as @app.route().",
    "hint_url": "https://learn.microsoft.com/en-us/azure/azure-functions/functions-reference-python?pivots=python-mode-decorators",
    "check_order": 0
  },
  {
    "id": "check_blueprint_registration",
    "category": "project_structure",
    "section": "programming_model",
    "label": "Blueprint registration",
    "description": "Warns when a Blueprint has decorators but is never registered on the FunctionApp.",
    "type": "blueprint_registration",
    "required": false,
    "condition": {},
    "hint": "Register each Blueprint with app.register_functions(bp) so its decorators are indexed at runtime.",
    "hint_url": "https://learn.microsoft.com/en-us/azure/azure-functions/functions-reference-python?pivots=python-mode-decorators",
    "check_order": 1
  },
  {
    "id": "check_python_version",
    "category": "environment",
    "section": "python_env",
    "label": "Python version",
    "description": "Checks that the target Python version is analyzable by Doctor (3.10\u20133.14); lifecycle support is checked separately.",
    "type": "compare_version",
    "required": true,
    "condition": {
      "target": "python",
      "operator": ">=",
      "value": "3.10"
    },
    "hint": "Target a Python version Doctor can analyze: 3.10, 3.11, 3.12, 3.13, or 3.14. The lifecycle check reports end-of-support versions.",
    "hint_url": "https://learn.microsoft.com/en-us/azure/azure-functions/functions-reference-python#supported-python-versions",
    "source_type": "ms_learn",
    "source_title": "Azure Functions Python developer guide — Supported Python versions",
    "source_url": "https://learn.microsoft.com/en-us/azure/azure-functions/functions-reference-python#supported-python-versions",
    "why_it_matters": "Doctor analyzes Python 3.10\u20133.14 and evaluates lifecycle support separately. Older targets (\u2264 3.9) or versions newer than Doctor recognizes can cause deployment failures and unsupported runtime errors.",
    "symptoms": "Deployment fails with 'Python version not supported'; functions fail to start; a too-new interpreter is silently downgraded or rejected by the host.",
    "fix_command": "pyenv install 3.12",
    "check_order": 1
  },
  {
    "id": "check_python_runtime_lifecycle",
    "category": "environment",
    "section": "python_env",
    "label": "Python runtime lifecycle",
    "description": "Checks the target Python version against its published Azure Functions end-of-support date, warning on a retiring runtime and failing on one past end-of-support.",
    "type": "python_runtime_lifecycle",
    "required": false,
    "tier": "core",
    "condition": {
      "target": "python"
    },
    "hint": "Target a Python version with a long support runway. Upgrade a retiring runtime before its Azure Functions end-of-support date.",
    "hint_url": "https://learn.microsoft.com/azure/azure-functions/supported-languages",
    "source_type": "ms_learn",
    "source_title": "Azure Functions \u2014 Supported languages (Python runtime lifecycle)",
    "source_url": "https://learn.microsoft.com/azure/azure-functions/supported-languages",
    "why_it_matters": "Azure Functions retires Python runtimes on a published schedule. Deploying on a runtime at or past end-of-support risks losing security updates and, eventually, the ability to deploy at all.",
    "symptoms": "Deployments on a retiring runtime keep working until the end-of-support date, then fail or lose patching; upgrades left too late force a rushed migration.",
    "check_order": 2
  },
  {
    "id": "check_functions_runtime_lifecycle",
    "category": "configuration",
    "section": "runtime",
    "label": "Functions runtime lifecycle",
    "description": "Checks the Azure Functions runtime major version (FUNCTIONS_EXTENSION_VERSION) for a Python app: v1 is incompatible with Python, v2/v3 are out of support, v3 on Linux Consumption stops running on a published date, and v4 is the current GA runtime.",
    "type": "functions_runtime_lifecycle",
    "required": false,
    "tier": "core",
    "condition": {},
    "hint": "Target the v4 Azure Functions runtime (FUNCTIONS_EXTENSION_VERSION=~4). The v1/v2/v3 runtimes are legacy or out of support; v1 does not support Python at all.",
    "hint_url": "https://learn.microsoft.com/azure/azure-functions/functions-versions",
    "source_type": "ms_learn",
    "source_title": "Azure Functions \u2014 Compare runtime versions (runtime lifecycle)",
    "source_url": "https://learn.microsoft.com/azure/azure-functions/functions-versions",
    "why_it_matters": "Running on a legacy or out-of-support Azure Functions runtime loses security updates and eventually the ability to run; runtime v1 cannot host a Python app at all.",
    "symptoms": "Host fails to start on an unsupported runtime; v3 Linux Consumption apps stop running after the published date; v1 rejects Python apps outright.",
    "tags": ["runtime", "lifecycle", "configuration"],
    "check_order": 3
  },
  {
    "id": "check_hosting_plan_lifecycle",
    "category": "configuration",
    "section": "runtime",
    "label": "Hosting plan lifecycle",
    "description": "Checks the resolved hosting plan against its published retirement date, informing on a distant retirement, warning inside the retiring-soon window, and failing once the plan has retired.",
    "type": "hosting_plan_lifecycle",
    "required": false,
    "tier": "core",
    "condition": {},
    "hint": "Linux Consumption is retiring; consider Flex Consumption for new Python workloads.",
    "hint_url": "https://learn.microsoft.com/azure/azure-functions/migration/migrate-plan-consumption-to-flex",
    "source_type": "ms_learn",
    "source_title": "Azure Functions \u2014 Migrate Consumption to Flex Consumption (hosting plan lifecycle)",
    "source_url": "https://learn.microsoft.com/azure/azure-functions/migration/migrate-plan-consumption-to-flex",
    "why_it_matters": "Hosting plans retire on a published schedule; an app left on a retiring plan must eventually migrate or stop running.",
    "symptoms": "Apps on a retiring hosting plan keep running until the retirement date, then must migrate; migrations left too late force a rushed move.",
    "tags": ["hosting-plan", "lifecycle", "flex-consumption", "configuration"],
    "check_order": 4
  },
  {
    "id": "check_flex_runtime_config",
    "category": "configuration",
    "section": "runtime",
    "label": "Flex Consumption runtime config",
    "description": "For a Flex Consumption app, validates the runtime declared under functionAppConfig.runtime (name/version) against the supported Python versions, and warns when a legacy linuxFxVersion is present (Flex ignores it).",
    "type": "flex_runtime_config",
    "required": false,
    "tier": "core",
    "condition": {},
    "hint": "Declare the Flex Consumption runtime under functionAppConfig.runtime (name/version); do not use linuxFxVersion.",
    "hint_url": "https://learn.microsoft.com/azure/azure-functions/flex-consumption-plan",
    "source_type": "ms_learn",
    "source_title": "Azure Functions \u2014 Flex Consumption plan (functionAppConfig.runtime)",
    "source_url": "https://learn.microsoft.com/azure/azure-functions/flex-consumption-plan",
    "why_it_matters": "Flex Consumption resolves its runtime from functionAppConfig.runtime and ignores linuxFxVersion; a misdeclared or unsupported runtime version fails to deploy or run.",
    "symptoms": "A Flex app with only linuxFxVersion set has no effective runtime declaration; an unsupported Python version is rejected at deploy time.",
    "tags": ["runtime", "flex-consumption", "configuration"],
    "check_order": 5
  },
  {
    "id": "check_flex_deprecated_settings",
    "category": "configuration",
    "section": "runtime",
    "label": "Flex Consumption deprecated app settings",
    "description": "For a Flex Consumption app, warns when legacy app settings that Flex ignores are declared (worker-runtime selection, Oryx/remote-build toggles, Azure Files content-share settings, run-from-package, and VNet route-all), citing the replacement mechanism for each.",
    "type": "flex_deprecated_settings",
    "required": false,
    "tier": "core",
    "condition": {},
    "hint": "Remove legacy app settings on Flex Consumption; configure the runtime, deployment, scaling, and networking through functionAppConfig and site networking properties instead.",
    "hint_url": "https://learn.microsoft.com/azure/azure-functions/functions-app-settings",
    "source_type": "ms_learn",
    "source_title": "Azure Functions \u2014 App settings reference (Flex Consumption plan deprecations)",
    "source_url": "https://learn.microsoft.com/azure/azure-functions/functions-app-settings",
    "why_it_matters": "Flex Consumption ignores a set of legacy app settings; leaving them in place is a configuration smell that masks the correct functionAppConfig-based configuration and can confuse deployments.",
    "symptoms": "Deprecated app settings are silently ignored on Flex Consumption, so settings such as FUNCTIONS_WORKER_RUNTIME or WEBSITE_RUN_FROM_PACKAGE have no effect and hide the real configuration.",
    "tags": ["runtime", "flex-consumption", "app-settings", "configuration"],
    "check_order": 6
  },
  {
    "id": "check_flex_deployment_storage",
    "category": "configuration",
    "section": "runtime",
    "label": "Flex Consumption deployment storage",